<?xml version="1.0" encoding="UTF-8"?>
<!DOCTYPE page SYSTEM "../doctypes/page.dtd">

<page>
    <meta-information>
        <title>Impressum</title>
        <author>Torsten Roeder</author>
        <date>November 2012</date>
        <filename>impressum.xml</filename>
        <translation lang="en">impressum</translation>
    </meta-information>
    <content display="all-divisions">
        <heading>Impressum</heading>
        <division>
            <section>
                <heading>Texte, Bilder, Technik und Layout</heading>
                <paragraph>
                    <line>Torsten Roeder</line>
                    <line>
                        <link type="web" href="http://www.torstenroeder.de/">www.torstenroeder.de</link>
                    </line>
                </paragraph>
            </section>
            <section>
                <heading>Grafiken</heading>
                <paragraph>
                    <line>Diese Seite verwendet einige der „Fugue Icons“ von Yusuke Kamiyamane.</line>
                    <line>
                        <link type="web" href="http://p.yusukekamiyamane.com/">p.yusukekamiyamane.com</link>
                    </line>
                    <line>
                        <link type="web" href="http://pinvoke.com/">pinvoke.com</link>
                    </line>
                </paragraph>
            </section>
        </division>
        <division>
            <heading>Rechtliche Hinweise</heading>
            <section>
                <heading>1. Haftungsbeschränkung</heading>
                <paragraph>Die Inhalte dieser Website werden mit größtmöglicher Sorgfalt erstellt. Der Anbieter übernimmt jedoch keine Gewähr für die
                    Richtigkeit, Vollständigkeit und Aktualität der bereitgestellten Inhalte. Die Nutzung der Inhalte der Website erfolgt auf eigene
                    Gefahr des Nutzers. Namentlich gekennzeichnete Beiträge geben die Meinung des jeweiligen Autors und nicht immer die Meinung des
                    Anbieters wieder. Mit der reinen Nutzung der Website des Anbieters kommt keinerlei Vertragsverhältnis zwischen dem Nutzer und dem
                    Anbieter zustande.</paragraph>
            </section>
            <section>
                <heading>2. Externe Links</heading>
                <paragraph>Diese Website enthält Verknüpfungen zu Websites Dritter ("externe Links"). Diese Websites unterliegen der Haftung der
                    jeweiligen Betreiber. Der Anbieter hat bei der erstmaligen Verknüpfung der externen Links die fremden Inhalte daraufhin überprüft,
                    ob etwaige Rechtsverstöße bestehen. Zu dem Zeitpunkt waren keine Rechtsverstöße ersichtlich. Der Anbieter hat keinerlei Einfluss
                    auf die aktuelle und zukünftige Gestaltung und auf die Inhalte der verknüpften Seiten. Das Setzen von externen Links bedeutet
                    nicht, dass sich der Anbieter die hinter dem Verweis oder Link liegenden Inhalte zu Eigen macht. Eine ständige Kontrolle dieser
                    externen Links ist für den Anbieter ohne konkrete Hinweise auf Rechtsverstöße nicht zumutbar. Bei Kenntnis von Rechtsverstößen
                    werden jedoch derartige externe Links unverzüglich gelöscht.</paragraph>
            </section>
            <section>
                <heading>3. Urheber- und Leistungsschutzrechte</heading>
                <paragraph>Die auf dieser Website veröffentlichten Inhalte unterliegen dem deutschen Urheber- und Leistungsschutzrecht. Jede vom
                    deutschen Urheber- und Leistungsschutzrecht nicht zugelassene Verwertung bedarf der vorherigen schriftlichen Zustimmung des
                    Anbieters oder jeweiligen Rechteinhabers. Dies gilt insbesondere für Vervielfältigung, Bearbeitung, Übersetzung, Einspeicherung,
                    Verarbeitung bzw. Wiedergabe von Inhalten in Datenbanken oder anderen elektronischen Medien und Systemen. Inhalte und Rechte
                    Dritter sind dabei als solche gekennzeichnet. Die unerlaubte Vervielfältigung oder Weitergabe einzelner Inhalte oder kompletter
                    Seiten ist nicht gestattet und strafbar. Lediglich die Herstellung von Kopien und Downloads für den persönlichen, privaten und
                    nicht kommerziellen Gebrauch ist erlaubt.</paragraph>
                <paragraph>Die Darstellung dieser Website in fremden Frames ist nur mit schriftlicher Erlaubnis zulässig.</paragraph>
            </section>
            <section>
                <heading>4. Datenschutz</heading>
                <paragraph>Durch den Besuch der Website des Anbieters können Informationen über den Zugriff (Datum, Uhrzeit, betrachtete Seite)
                    gespeichert werden. Diese Daten gehören nicht zu den personenbezogenen Daten, sondern sind anonymisiert. Sie werden ausschließlich
                    zu statistischen Zwecken ausgewertet. Eine Weitergabe an Dritte, zu kommerziellen oder nichtkommerziellen Zwecken, findet nicht
                    statt.</paragraph>
                <paragraph>Der Anbieter weist ausdrücklich darauf hin, dass die Datenübertragung im Internet (z.B. bei der Kommunikation per E-Mail)
                    Sicherheitslücken aufweisen und nicht lückenlos vor dem Zugriff durch Dritte geschützt werden kann.</paragraph>
                <paragraph>Die Verwendung der Kontaktdaten des Impressums zur gewerblichen Werbung ist ausdrücklich nicht erwünscht, es sei denn der
                    Anbieter hatte zuvor seine schriftliche Einwilligung erteilt oder es besteht bereits eine Geschäftsbeziehung. Der Anbieter und
                    alle auf dieser Website genannten Personen widersprechen hiermit jeder kommerziellen Verwendung und Weitergabe ihrer
                    Daten.</paragraph>
            </section>
            <section>
                <heading>5. Besondere Nutzungsbedingungen</heading>
                <paragraph>Soweit besondere Bedingungen für einzelne Nutzungen dieser Website von den vorgenannten Nummern 1. bis 4. abweichen, wird
                    an entsprechender Stelle ausdrücklich darauf hingewiesen. In diesem Falle gelten im jeweiligen Einzelfall die besonderen
                    Nutzungsbedingungen.</paragraph>
            </section>
            <section>
                <paragraph>Quelle: <link type="web" href="http://www.juraforum.de/">www.juraforum.de</link></paragraph>
            </section>
        </division>
    </content>
</page>
