<?xml version="1.0" encoding="UTF-8"?>
<!DOCTYPE page SYSTEM "../doctypes/page.dtd">

<page>
    <meta-information>
        <title>Contact</title>
        <author>Torsten Roeder</author>
        <date>November 2012</date>
        <filename>contact.xml</filename>
        <translation lang="de">kontakt</translation>
    </meta-information>
    <content display="all-divisions">
        <heading>Contact</heading>
        <division>
            <paragraph>
                <line>Torsten Roeder</line>
                <link type="web" href="http://www.torstenroeder.de">torstenroeder.de</link>
            </paragraph>
        </division>
    </content>
</page>
